{
  "$schema": "http://json-schema.org/draft-07/schema#",
  "$id": "https://github.com/resp-bench/schemas/driver-config.schema.json",
  "title": "Driver Configuration",
  "description": "Configuration for a benchmark client driver in resp-bench",
  "type": "object",
  "required": ["schema_version", "driver_id", "mode"],
  "properties": {
    "schema_version": {
      "type": "string",
      "description": "Schema version for compatibility checking",
      "enum": ["1.0"]
    },
    "description": {
      "type": "string",
      "description": "Human-readable description of this driver configuration"
    },
    "driver_id": {
      "type": "string",
      "description": "Identifier for the client driver implementation",
      "examples": ["jedis", "lettuce", "valkey-glide", "redisson", "stackexchange-redis", "valkey-glide-csharp", "valkey-glide-node", "ioredis", "iovalkey", "redis-py", "aioredis"]
    },
    "mode": {
      "type": "string",
      "description": "Server topology mode",
      "enum": ["standalone", "cluster", "sentinel"]
    },
    "command_timeout_ms": {
      "type": "integer",
      "minimum": 1,
      "description": "Command timeout in milliseconds. Applied to all drivers that support it."
    },
    "tls": {
      "type": "object",
      "description": "TLS/SSL configuration",
      "properties": {
        "enabled": {
          "type": "boolean",
          "default": false
        },
        "cert_path": {
          "type": "string",
          "description": "Path to client certificate"
        },
        "key_path": {
          "type": "string",
          "description": "Path to client private key"
        },
        "ca_path": {
          "type": "string",
          "description": "Path to CA certificate"
        },
        "verify_hostname": {
          "type": "boolean",
          "default": true
        }
      }
    },
    "auth": {
      "type": "object",
      "description": "Authentication configuration",
      "properties": {
        "username": {
          "type": "string",
          "description": "Username for ACL authentication"
        },
        "password": {
          "type": "string",
          "description": "Password for authentication"
        }
      }
    },
    "specific_driver_config": {
      "type": "object",
      "description": "Driver-specific configuration options. Valid keys depend on the driver_id. See per-driver schemas in configs/schemas/specific-driver-configs/.",
      "additionalProperties": true
    }
  },
  "allOf": [
    {
      "if": {
        "properties": { "driver_id": { "const": "lettuce" } }
      },
      "then": {
        "properties": {
          "specific_driver_config": { "$ref": "specific-driver-configs/lettuce.schema.json" }
        }
      }
    }
  ],
  "additionalProperties": false
}
