{
    "schema_version": "1.0",
    "description": "Spring Data Redis with Lettuce driver - reference benchmark configuration",
    "driver_id": "spring-data-redis",
    "mode": "standalone",
    "specific_driver_config": {
        "secondary_driver_id": "lettuce",
        "use_pooling": true,
        "pool_size": 8
    }
}
