{
    "schema_version": "1.0",
    "description": "spring-data-valkey with Jedis driver - high-throughput configuration",
    "driver_id": "spring-data-valkey",
    "mode": "standalone",
    "specific_driver_config": {
        "secondary_driver_id": "jedis",
        "use_pooling": true,
        "pool_size": 8
    }
}
