{
    "schema_version": "1.0",
    "description": "spring-data-redis with Lettuce driver - high-throughput configuration",
    "driver_id": "spring-data-redis",
    "mode": "standalone",
    "specific_driver_config": {
        "secondary_driver_id": "lettuce",
        "use_pooling": true,
        "pool_size": 8,
        "share_native_connection": false
    },
    "command_timeout_ms": 10000
}
