{
    "schema_version": "1.0",
    "description": "Spring Data Valkey with valkey-glide driver - high-throughput configuration",
    "driver_id": "spring-data-valkey",
    "mode": "standalone",
    "specific_driver_config": {
        "secondary_driver_id": "valkey-glide",
        "pool_size": 8
    }
}
