{
    "schema_version": "1.0",
    "description": "Recording client — fast (10ms median latency) for e2e testing",
    "driver_id": "recording",
    "mode": "standalone",
    "specific_driver_config": {
        "latency_distribution": "log_normal",
        "latency_min_ms": 5,
        "latency_median_ms": 10,
        "latency_p9999_target_ms": 50
    }
}
