{
    "schema_version": "1.0",
    "description": "Spring Data Valkey with Lettuce driver - standalone mode",
    "driver_id": "spring-data-valkey",
    "mode": "standalone",
    "specific_driver_config": {
        "secondary_driver_id": "lettuce",
        "use_pooling": true,
        "pool_size": 8,
        "share_native_connection": false
    }
}
